{
  "schema_id": "climateos.cooma_public_evidence_claims.v0.1",
  "pilot": {
    "base_main_sha": "b6c495b81e0a74afac1971f5b18366cb1aa1f99c",
    "place_name": "Cooma",
    "accessed_on": "2026-07-17",
    "mode": "ZERO_DOWNLOAD_OFFICIAL_HTML_STRUCTURED_CLAIMS",
    "purpose": "SOURCE_ASSERTION_ADMISSION_AND_RELATION_TRANSITION_GATE"
  },
  "selected_sources": [
    {
      "source_id": "COOMA-SRC-006",
      "publisher": "Snowy Monaro Regional Council",
      "canonical_url": "https://www.snowymonaro.nsw.gov.au/Water-and-Wastewater/Water-Supply/Where-Does-My-Water-Come-From",
      "source_kind": "COUNCIL_WATER_SOURCE_LANDING",
      "accessed_on": "2026-07-17",
      "page_format": "HTML",
      "licence_state": "NOT_ASSESSED_REFERENCE_ONLY",
      "reuse_permission": "NOT_CLAIMED",
      "raw_page_body_retained": false,
      "verbatim_excerpt_retained": false,
      "file_downloaded": false,
      "dataset_downloaded": false,
      "claim_count": 2
    },
    {
      "source_id": "COOMA-SRC-007",
      "publisher": "Australian Bureau of Meteorology",
      "canonical_url": "https://www.bom.gov.au/climate/averages/tables/cw_070217.shtml",
      "source_kind": "STATION_METADATA",
      "accessed_on": "2026-07-17",
      "page_format": "HTML",
      "licence_state": "NOT_ASSESSED_REFERENCE_ONLY",
      "reuse_permission": "NOT_CLAIMED",
      "raw_page_body_retained": false,
      "verbatim_excerpt_retained": false,
      "file_downloaded": false,
      "dataset_downloaded": false,
      "claim_count": 2
    },
    {
      "source_id": "COOMA-SRC-009",
      "publisher": "Australian Government Department of Climate Change, Energy, the Environment and Water",
      "canonical_url": "https://www.dcceew.gov.au/cewh/water-region/murrumbidgee-river-valley/about",
      "source_kind": "FEDERAL_CATCHMENT_CONTEXT",
      "accessed_on": "2026-07-17",
      "page_format": "HTML",
      "licence_state": "NOT_ASSESSED_REFERENCE_ONLY",
      "reuse_permission": "NOT_CLAIMED",
      "raw_page_body_retained": false,
      "verbatim_excerpt_retained": false,
      "file_downloaded": false,
      "dataset_downloaded": false,
      "claim_count": 1
    }
  ],
  "claims": [
    {
      "claim_id": "COOMA-CLAIM-001",
      "source_id": "COOMA-SRC-006",
      "claim_type": "WATER_SOURCE_DESCRIPTION",
      "claim_form": "CONTROLLED_PARAPHRASE",
      "controlled_paraphrase": "The Council page identifies the Murrumbidgee River as the water source listed for Cooma.",
      "verbatim_excerpt": null,
      "locator_type": "HTML_HEADING_AND_FIELD",
      "locator_label": "Cooma section; Water Source field",
      "subject": "Cooma town water supply listing",
      "predicate": "source listed by publisher",
      "object_text": "Murrumbidgee River",
      "geographic_relevance": "DIRECT_COOMA",
      "time_scope": "PAGE_STATE_AT_ACCESS",
      "version_state": "NO_VISIBLE_PUBLICATION_OR_REVISION_DATE_CAPTURED_RECHECK_REQUIRED",
      "licence_state": "NOT_ASSESSED_REFERENCE_ONLY",
      "admission_state": "SOURCE_ASSERTION_REFERENCE_ONLY",
      "evidence_relation_eligible": false,
      "uncertainty_flags": ["PUBLIC_PAGE_MAY_CHANGE", "COUNCIL_WEB_NOT_ASSUMED_COMPLETE", "CURRENT_OPERATION_NOT_VERIFIED"],
      "prohibited_inferences": ["CURRENT_WATER_QUALITY", "CURRENT_FLOW_OR_CAPACITY", "CATCHMENT_BOUNDARY", "WORKSITE_OR_COMPLIANCE_STATE"],
      "human_review_state": "UNASSIGNED_NOT_APPROVED"
    },
    {
      "claim_id": "COOMA-CLAIM-002",
      "source_id": "COOMA-SRC-006",
      "claim_type": "WATER_TREATMENT_DESCRIPTION",
      "claim_form": "CONTROLLED_PARAPHRASE",
      "controlled_paraphrase": "The Council page describes Cooma treatment through the town water treatment plant and mentions fluoridation.",
      "verbatim_excerpt": null,
      "locator_type": "HTML_HEADING_AND_FIELD",
      "locator_label": "Cooma section; Treatment field",
      "subject": "Cooma town water treatment listing",
      "predicate": "treatment description published by Council",
      "object_text": "Cooma water treatment plant with fluoridation mentioned",
      "geographic_relevance": "DIRECT_COOMA",
      "time_scope": "PAGE_STATE_AT_ACCESS",
      "version_state": "NO_VISIBLE_PUBLICATION_OR_REVISION_DATE_CAPTURED_RECHECK_REQUIRED",
      "licence_state": "NOT_ASSESSED_REFERENCE_ONLY",
      "admission_state": "SOURCE_ASSERTION_REFERENCE_ONLY",
      "evidence_relation_eligible": false,
      "uncertainty_flags": ["PUBLIC_PAGE_MAY_CHANGE", "CURRENT_PROCESS_STATE_NOT_VERIFIED", "NO_OPERATIONAL_RECORD_ACCESSED"],
      "prohibited_inferences": ["TREATMENT_PERFORMANCE", "DRINKING_WATER_COMPLIANCE", "CURRENT_PLANT_STATE", "WORK_INSTRUCTION"],
      "human_review_state": "UNASSIGNED_NOT_APPROVED"
    },
    {
      "claim_id": "COOMA-CLAIM-003",
      "source_id": "COOMA-SRC-007",
      "claim_type": "STATION_IDENTITY",
      "claim_form": "CONTROLLED_PARAPHRASE",
      "controlled_paraphrase": "The Bureau page identifies station 070217 as Cooma Airport AWS.",
      "verbatim_excerpt": null,
      "locator_type": "HTML_HEADING_AND_FIELD",
      "locator_label": "Site information; Site name and Site number fields",
      "subject": "Bureau station 070217",
      "predicate": "station identity shown by publisher",
      "object_text": "Cooma Airport AWS",
      "geographic_relevance": "OBSERVATION_STATION",
      "time_scope": "PAGE_STATE_AT_ACCESS",
      "version_state": "STATION_METADATA_VISIBLE_AT_ACCESS_RECHECK_REQUIRED",
      "licence_state": "NOT_ASSESSED_REFERENCE_ONLY",
      "admission_state": "SOURCE_ASSERTION_REFERENCE_ONLY",
      "evidence_relation_eligible": false,
      "uncertainty_flags": ["PAGE_REPORTS_PRODUCT_PROBLEMS", "STATION_STATUS_MAY_CHANGE", "REPRESENTATIVENESS_NOT_ASSESSED"],
      "prohibited_inferences": ["COOMA_CLIMATE_REPRESENTATIVENESS", "CURRENT_WEATHER", "CLIMATE_TREND", "WORKSITE_CONDITION"],
      "human_review_state": "UNASSIGNED_NOT_APPROVED"
    },
    {
      "claim_id": "COOMA-CLAIM-004",
      "source_id": "COOMA-SRC-007",
      "claim_type": "STATION_LOCATION_METADATA",
      "claim_form": "CONTROLLED_PARAPHRASE",
      "controlled_paraphrase": "The Bureau page lists station 070217 at approximately 36.29 degrees south, 148.97 degrees east and 930 metres elevation.",
      "verbatim_excerpt": null,
      "locator_type": "HTML_HEADING_AND_FIELD",
      "locator_label": "Site information; Latitude, Longitude and Elevation fields",
      "subject": "Bureau station 070217",
      "predicate": "location metadata shown by publisher",
      "object_text": "36.29 S, 148.97 E, elevation 930 m",
      "geographic_relevance": "OBSERVATION_STATION",
      "time_scope": "PAGE_STATE_AT_ACCESS",
      "version_state": "STATION_METADATA_VISIBLE_AT_ACCESS_RECHECK_REQUIRED",
      "licence_state": "NOT_ASSESSED_REFERENCE_ONLY",
      "admission_state": "SOURCE_ASSERTION_REFERENCE_ONLY",
      "evidence_relation_eligible": false,
      "uncertainty_flags": ["COORDINATE_PRECISION_LIMITED_TO_PAGE", "REPRESENTATIVENESS_NOT_ASSESSED", "NO_OBSERVATION_DATA_ADMITTED"],
      "prohibited_inferences": ["TOWN_WIDE_REPRESENTATIVENESS", "CATCHMENT_REPRESENTATIVENESS", "PROPERTY_LEVEL_WEATHER", "CLIMATE_CONCLUSION"],
      "human_review_state": "UNASSIGNED_NOT_APPROVED"
    },
    {
      "claim_id": "COOMA-CLAIM-005",
      "source_id": "COOMA-SRC-009",
      "claim_type": "BROAD_VALLEY_GEOGRAPHY",
      "claim_form": "CONTROLLED_PARAPHRASE",
      "controlled_paraphrase": "The department page describes the Murrumbidgee River Valley as extending through southern New South Wales and the Australian Capital Territory, from the Australian Alps toward semi-arid riverine plains.",
      "verbatim_excerpt": null,
      "locator_type": "HTML_HEADING_AND_FIELD",
      "locator_label": "About the Murrumbidgee River Valley; introductory geography paragraph",
      "subject": "Murrumbidgee River Valley",
      "predicate": "broad geography described by publisher",
      "object_text": "Southern NSW and ACT from Australian Alps toward semi-arid riverine plains",
      "geographic_relevance": "MURRUMBIDGEE_VALLEY",
      "time_scope": "PAGE_STATE_AT_ACCESS",
      "version_state": "PAGE_LAST_UPDATED_2024-10-21_RECHECK_REQUIRED",
      "licence_state": "NOT_ASSESSED_REFERENCE_ONLY",
      "admission_state": "SOURCE_ASSERTION_REFERENCE_ONLY",
      "evidence_relation_eligible": false,
      "uncertainty_flags": ["BROAD_VALLEY_SCALE", "COOMA_OVERLAP_NOT_ESTABLISHED_BY_THIS_PAGE", "LOCAL_CONDITION_NOT_ASSESSED"],
      "prohibited_inferences": ["COOMA_CATCHMENT_BOUNDARY", "COOMA_ECOLOGICAL_STATE", "LOCAL_WATER_QUALITY", "CAUSAL_RELATIONSHIP"],
      "human_review_state": "UNASSIGNED_NOT_APPROVED"
    }
  ],
  "relation_trials": [
    {
      "relation_trial_id": "COOMA-REL-TRIAL-001",
      "claim_ids": ["COOMA-CLAIM-001", "COOMA-CLAIM-005"],
      "proposed_relation": "Cooma published water-source listing to broad Murrumbidgee Valley context",
      "gate_checks": {
        "source_identity": "PASS_METADATA_BOUND",
        "licence": "BLOCKED_NOT_ASSESSED",
        "geography": "BLOCKED_SCALE_OVERLAP_NOT_ESTABLISHED",
        "temporal_alignment": "BLOCKED_POINT_IN_TIME_PAGES",
        "uncertainty": "BLOCKED_NOT_ASSESSED",
        "stationarity": "BLOCKED_NOT_ASSESSED",
        "expert_review": "BLOCKED_UNASSIGNED"
      },
      "outcome": "REJECTED_SCALE_AND_REVIEW_GAPS",
      "evidence_relation_promoted": false,
      "mechanism_candidate_activated": false,
      "reason": "Shared river naming and broad context do not establish a mapped Cooma catchment, current state, causal link or reviewed evidence relation.",
      "human_review_required": true
    },
    {
      "relation_trial_id": "COOMA-REL-TRIAL-002",
      "claim_ids": ["COOMA-CLAIM-003", "COOMA-CLAIM-004"],
      "proposed_relation": "Cooma Airport AWS identity to town or catchment climate representativeness",
      "gate_checks": {
        "source_identity": "PASS_METADATA_BOUND",